finding,data_source,observation,wcag,impact,inclusion,effort,priority
Comment appears as required,T1_evidence.png,"topline comment appears on submit",4.1.3,1,1,1,1
No method implemented to swap colour schemes,P1 notes + T2_evidence.png,"no way of changing theme in the webpage",1.4.3,4,3,2,5
Controlling page with tabs/enter easy,T3_evidence.png,"easy to navigate around page",2.1.2,1,1,1,1
Mouse hover does not change functionality/perform an operation,T4_evidence.png,"no change to site on hover",3.2.2,1,1,1,1
Dark mode contrast is sufficient,T5_evidence.png,"everything is easily readable",1.4.3,1,1,1,1
SR speaks but no subtitles provided,T6_evidence.png,"no subtitles seen",3.3.1,4,5,3,6
Doesn't update the task counter once tasks are added,T&_no-update.png,"not adding to total number of tasks without reloading page",N/A,2,1,1,2